{
  "schema_version": "2.0.0",
  "artifact_type": "30_analysis",
  "investigation_id": "INV-000034",
  "rq_id": "RQ-000034",
  "analyzed_at": "2026-10-06T01:18:19Z",
  "question_type": "Conceptual",
  "profile": {
    "concept": "Dynamic Pricing as a repeated, state-contingent price-setting decision process",
    "proposed_definition": "Dynamic Pricingは、意思決定時点ごとに観測可能な状態・情報と価格に対する需要反応を踏まえ、有限な在庫・容量、販売期間、許容価格集合等の意思決定上の制約の下で目的を達成する価格を選択し、状態や情報が変化するにつれて価格決定を更新する価格設定アプローチである。",
    "dimensions": [
      "目的関数：何を最適化するか",
      "状態・情報：在庫、残存時間、需要条件、顧客・商品・時期・場所等の何を価格決定に用いるか",
      "意思決定変数：どの価格または価格を含むofferを選択するか",
      "価格反応：価格に応じて需要がどう変化するかをどう扱うか",
      "意思決定上の制約：有限な在庫・容量、販売期間、許容価格集合等が実行可能な価格政策をどう制約するか",
      "その他のmodel features / extensions：time-varying demand、holding costs、discounting、reordering、overbooking、cancellations等を制約と混同せずどう位置付けるか",
      "更新・フィードバック：状態変化や新たな販売情報を後続の価格決定へどう反映するか"
    ],
    "boundary_cases": [],
    "relations_to_adjacent_concepts": [],
    "ambiguities": [
      "古典的ORモデルでは売上最大化が中心だが、実務上の目的が常に売上だけかは本Investigationでは確定しない。",
      "関連する状態・情報の普遍的な集合は固定されず、古典モデルは在庫・時間を重視する一方、近年の定義はより広い需要文脈を含む。",
      "販売データからの学習は重要なDynamic Pricing設定だが、すべてのDynamic Pricingの定義要件かは本Evidenceでは支持されない。"
    ]
  },
  "working_answer": {
    "text": "ダイナミックプライシングの基本原理は、価格を一度固定するのではなく、各意思決定時点で現在の状態・情報を観測し、価格に応じた需要反応と意思決定上の制約を踏まえて目的に適う価格を選び、状態や情報の変化に応じてその価格決定を更新することである。古典的なOperations Researchでは、残存在庫・残存時間・価格感応的で不確実な需要を主要な状態として、有限の販売期間で期待売上または総売上を最大化する問題として定式化される。有限な在庫・容量、販売期間、許容価格集合は実行可能な価格政策を制約し得る一方、time-varying demand、holding costs、discounting、reordering、overbooking、cancellations等は、需要過程、目的・コスト構造、または状態遷移を変える異質なmodel features / extensionsとして区別すべきである。より広い定義では、価格変更の契機となる情報は在庫・時間だけでなく、顧客、商品構成、時期、場所などの需要条件にも及ぶ。したがって本質は特定のMLアルゴリズムではなく、『目的・状態情報・価格という意思決定変数・需要反応・意思決定上の制約』を結び付けたstate-contingentな反復意思決定にある。販売結果から需要反応を学習して後続の価格へ反映するfeedback loopは重要な拡張だが、すべてのDynamic Pricingに必須とは限らない。",
    "knowledge_unit_refs": [
      "K0001",
      "K0002",
      "K0003",
      "K0004",
      "K0005",
      "K0006",
      "K0007"
    ]
  },
  "judgments": [
    {
      "judgment_id": "J0001",
      "statement": "Dynamic Pricingの中核は、現在の状態・情報に条件付けて価格を繰り返し選択・更新する意思決定構造である。",
      "knowledge_unit_refs": [
        "K0001",
        "K0003"
      ]
    },
    {
      "judgment_id": "J0002",
      "statement": "価格決定は、最適化したい目的、価格に対する需要反応、在庫・容量・販売期間・許容価格集合等の意思決定上の制約を統合して行われる。古典的OR定式化では有限期間の売上最大化が代表的である一方、time-varying demandやholding costs、reordering、overbooking等は制約と一括せず、需要・コスト・状態遷移を変えるmodel features / extensionsとして扱う必要がある。",
      "knowledge_unit_refs": [
        "K0002",
        "K0003",
        "K0004",
        "K0005"
      ]
    },
    {
      "judgment_id": "J0003",
      "statement": "Dynamic Pricingを特定のAI/ML手法と同一視すべきではない。頻繁な価格変更を可能にするデータ・低い変更摩擦・意思決定支援は実装上のenablerであり、販売結果から学習するfeedbackは重要な拡張である。",
      "knowledge_unit_refs": [
        "K0006",
        "K0007"
      ]
    }
  ],
  "limitations": [
    {
      "text": "主要Evidenceはpeer-reviewed論文のpublisher abstract / introductionで直接確認できる範囲に限定したため、各モデルの数理的詳細や条件別の最適政策までは評価していない。また、Gallego–van Ryzinで列挙される拡張は異質であり、すべてを同一の『制約』カテゴリとして扱っていない。",
      "knowledge_unit_refs": [
        "K0002",
        "K0003",
        "K0004",
        "K0005"
      ]
    },
    {
      "text": "選択SourceはOperations Research / Revenue Managementとretail conceptual literatureに偏る。Dynamic Pricingの全業界で目的関数や状態変数が同一であるとは結論しない。",
      "knowledge_unit_refs": [
        "K0001",
        "K0002",
        "K0003"
      ]
    },
    {
      "text": "Revenue Management、Yield Management、personalized pricing等との体系的な概念境界はRQ2、具体的アルゴリズムはRQ3、旅行代理店・OTAでの適用はRQ4の範囲であり、本Analysisでは扱っていない。"
    }
  ],
  "unresolved_questions": [
    "売上最大化以外の利益・顧客体験・長期価値等の目的を、Dynamic Pricingの一般原理にどこまで含めるべきか。",
    "需要学習を伴わない予め規定されたstate-dependent pricing policyと、online learningを伴うDynamic Pricingを概念上どこまで同一カテゴリとして扱うべきか。"
  ],
  "alternative_interpretations": [
    {
      "text": "狭義には、Dynamic Pricingを有限期間・在庫／容量制約下のintertemporal revenue optimizationとして捉えることができる。一方、近年の広義定義では、顧客・商品・時期・場所などの需要条件の差に応じた価格変更まで含む。",
      "knowledge_unit_refs": [
        "K0001",
        "K0003",
        "K0005"
      ]
    }
  ]
}
