{
  "schema_version": "2.0.0",
  "artifact_type": "30_analysis",
  "investigation_id": "INV-000004",
  "rq_id": "RQ-0015",
  "analyzed_at": "2026-09-22T11:12:24Z",
  "question_type": "Descriptive",
  "profile": {
    "target": "江戸後期〜明治末の日本における道路ベースの貨物輸送について、荷の受領・中継・引渡し、記録、責任分界の通常実務・制度を記述する。",
    "constructs": ["受領・中継・引渡し","継立主体と役割分担","帳簿・送状・貨物引換証等の記録","荷・託送の識別情報","利用資格・引渡権限の確認","滅失・毀損・延着に対する責任"],
    "summary_statistics_or_patterns": [
      "江戸期の公用道路輸送では宿駅ごとの継立が制度上の基本単位で、問屋場・宿役人が運用した。",
      "具体例では、荷とともに帳面が次宿へ渡され、受取駄賃・次宿・荷物・残額が継続的に記録された。",
      "民間商業輸送には相対賃銭、馬借、飛脚問屋、私的継立など、公用宿駅制度とは異なる経路・主体が併存した。",
      "明治後期には運送状・貨物引換証が荷の種類、重量・容積、荷造、個数・記号、到達地、荷受人等を記録する法的文書として整備された。",
      "ただし送状・貨物引換証は全荷物に一律必須ではなく、小荷物や請求の有無により文書を用いない場合もあった。",
      "明治後期には受取・引渡・保管・運送について運送人の注意義務と損害賠償責任、相次運送人の連帯責任が明文化された。"
    ],
    "coverage_limits": [
      "近世の具体的受渡手順を直接示すEvidenceは限定的で、全国・全荷種の頻度分布は不明。",
      "荷姿・数量・封印等の現物検査手順は一般化できない。",
      "荷札の常用実態はselected Evidenceでは直接確認できない。",
      "1870年代から1890年代にかけての制度移行を連続的には追えていない。",
      "飛脚問屋の個別荷物オペレーションは未抽出。"
    ]
  },
  "working_answer": {
    "text": "江戸後期〜明治期の陸上貨物輸送には、期間全体を貫く全国一律の単一SOPがあったとはいえない。江戸期の公用道路輸送では、宿駅ごとの継立が基本で、問屋場・宿役人が荷を受け取り、次宿へ引き渡した。1794年の具体例では、荷とともに人馬駄賃帳が移動し、各宿で受取駄賃、次宿、荷物、賃銭残額を記録して次へ渡しており、受渡しの連鎖と帳面上の記録が結び付いていた。公用利用では御朱印・御証文の照合や先触による事前手配も行われた。一方、商業貨物は公用宿継だけでなく、相対賃銭の馬子・人足、地域の馬借、飛脚問屋、明治初年の私的継立機関など複数の経路で運ばれた。明治後期になると、運送状・貨物引換証に荷の種類、重量・容積、荷造、個数・記号、到達地、荷受人等を記録する法的枠組みが整い、貨物引換証を作成した場合は証券との引換えで引渡しを請求する仕組みも設けられた。ただし、これらの文書は全荷物に常時必須ではなく、小荷物では送状を付さない慣行や、請求時のみ貨物引換証を発行する運用も認識されていた。責任面では、1899年商法が受取・引渡・保管・運送に関する運送人の注意義務、滅失・毀損・延着の賠償責任、相次運送人の連帯責任を明文化した。したがって、当時の「荷の信頼性管理」は、近世の宿駅・運送主体による継立と帳簿記録、利用資格確認に、明治期には託送内容を記載する文書と法的責任分界が加わる形で理解するのがEvidenceに最も整合する。",
    "knowledge_unit_refs": ["K0001","K0002","K0003","K0004","K0005","K0006","K0007","K0008","K0009","K0010"]
  },
  "judgments": [
    {"judgment_id":"J0001","statement":"「標準的」を全国一律の単一手順と解釈するのは不適切であり、公用宿駅、民間商業輸送、明治後期の商業運送法制を時期・制度別に分けて記述する必要がある。","knowledge_unit_refs":["K0001","K0004","K0005","K0010"]},
    {"judgment_id":"J0002","statement":"江戸期の宿駅継立で直接確認できる中核的な管理機能は、荷の受領・次宿への引渡しと、駄賃・次宿・荷物・残額を帳面に記録して継続させることである。","knowledge_unit_refs":["K0001","K0002"]},
    {"judgment_id":"J0003","statement":"明治後期には、託送内容を文書上で識別できる項目と、貨物引換証に基づく引渡し統制が制度化され、記録と引渡権限の結び付きが近世の駄賃帳より明示的になった。","knowledge_unit_refs":["K0006","K0008"]},
    {"judgment_id":"J0004","statement":"送状・貨物引換証を全荷物共通の必須帳票とみなすことはEvidenceに反し、荷種や当事者の請求による条件付き運用として扱うべきである。","knowledge_unit_refs":["K0006","K0007","K0008"]},
    {"judgment_id":"J0005","statement":"責任管理については、少なくとも明治後期には受取・引渡・保管・運送という工程横断の注意義務と、相次運送人の連帯責任が法的に明文化されていた。","knowledge_unit_refs":["K0009"]},
    {"judgment_id":"J0006","statement":"選択Evidenceから荷の同一性管理を復元する際、荷札の存在を前提にするより、継立主体、帳面・送状の記載、証文照合、引換証、責任分界といった複数の管理機能の組合せとして捉える方が支持される。","knowledge_unit_refs":["K0002","K0003","K0006","K0008","K0009"]}
  ],
  "limitations": [
    {"text":"1794年の状箱輸送は具体的な受渡・記帳手順を示すが、公用性の強い事例であり、商人荷物・生糸・高価品などへ同じ手順をそのまま一般化できない。","knowledge_unit_refs":["K0002"]},
    {"text":"民間輸送のEvidenceは相対賃銭・馬借・私的継立の存在と区間輸送を示す一方、荷受時の検品、数量照合、受取証、紛失時処理まで一連の手順を復元できていない。","knowledge_unit_refs":["K0004","K0005"]},
    {"text":"明治後期の商法は法的規範を直接示すが、規範が各地域・荷種でどの程度実務化されていたかは別問題であり、発行率や遵守率を示すEvidenceはない。","knowledge_unit_refs":["K0006","K0007","K0008","K0009"]},
    {"text":"荷札・封印・荷姿検査・数量検査の常用実態はselected Evidenceで不足しているため、それらを標準的同一性管理手段とは断定していない。","knowledge_unit_refs":["K0002","K0006"]},
    {"text":"対象期間は約1世紀に及び、明治初年の宿駅再編から1899年商法までの移行過程を連続的にカバーできていない。","knowledge_unit_refs":["K0004","K0010"]}
  ],
  "unresolved_questions": [
    "江戸後期の民間商人荷物では、荷受け時に数量・荷姿・封印・荷札をどのように照合したか。",
    "紛失・盗難・毀損が生じた際、近世の宿駅・馬借・飛脚問屋では誰がどの証拠に基づき責任を負担したか。",
    "明治初期の陸運会社・駅逓制度への再編で、旧来の宿駅帳簿・送状・受取証の運用はどの時点でどう変化したか。",
    "生糸など高価・品質差の大きい商品では、一般貨物より強い同一性・由来管理が行われたか。"
  ],
  "alternative_interpretations": [
    {"text":"「標準的」を幕府・政府が定めた規範的制度だけに限定するなら、公用宿駅制度と1899年商法が中心となり、馬借・飛脚問屋等の民間慣行は補助的位置になる。","knowledge_unit_refs":["K0001","K0003","K0006","K0008","K0009"]},
    {"text":"「標準的」を実際の商業荷物の多数派慣行と解釈するなら、現Evidenceは公用制度・法規範に比して民間実務の密度が不足しており、追加一次史料なしには強い全国一般化を避けるべきである。","knowledge_unit_refs":["K0002","K0004","K0005","K0007"]}
  ]
}
