{
  "schema_version": "2.0.0",
  "artifact_type": "30_analysis",
  "investigation_id": "INV-000015",
  "rq_id": "RQ-0019",
  "analyzed_at": "2026-09-22T23:17:30.000Z",
  "question_type": "Descriptive",
  "profile": {
    "target": "現在の町田市域・南多摩における自由民権運動が、1880年代の地域運動から1890年代初頭の政党政治・国政選挙へどのように再編され、1892年第2回衆議院議員総選挙でどのような政治対立・行政介入・地域内暴力として現れたかを記述する。",
    "constructs": [
      "地域民権運動から自由党への組織的接続",
      "自由党解党後の再組織化と派閥分化",
      "1890年・1892年衆議院議員総選挙における候補者配置",
      "神奈川県第3区における政府・県行政・警察による選挙干渉",
      "第2回総選挙の得票結果",
      "凌霜館を含む地域活動家ネットワークと大須賀明殺害事件",
      "選挙後の神奈川県会における知事・警部長への責任追及",
      "1892年政治闘争と三多摩移管をめぐる後続検証論点"
    ],
    "summary_statistics_or_patterns": [
      "1881年の自由党結成後、武相地域の民権運動は自由党参加へ接続し、自由党解党後も再組織化と内部分化を経て国政選挙へ展開した。",
      "吉野泰三の政治的位置は固定的ではなく、1890年第1回総選挙前には再興自由党への加盟と候補化の動きがあり、1892年第2回総選挙では吏党側候補として石阪昌孝・瀬戸岡為一郎ら自由党候補と競合し、その後1892年8月に国民協会へ正式加入した。",
      "1892年2月12日、内海忠勝神奈川県知事は松方正義宛報告で八王子方面への巡査約100名投入と石阪・瀬戸岡両名の落選期待を述べたと『多摩市史』は引用している。",
      "第2回総選挙の神奈川県第3区では、石阪昌孝890票、瀬戸岡為一郎720票が当選し、吉野泰三663票が次点となった。",
      "選挙戦では村野常右衛門・森久保作蔵の拘束等が記録され、『神奈川県史』も警察官動員・民党壮士への拘束圧迫・双方の衝突を叙述する。",
      "町田市が公開する1892年裁判文書の翻刻は、大須賀明殺害事件について、被告らが石阪・瀬戸岡を当選させるため運動し、大須賀が吉野泰三支持へ転じたことへの憤りを事件背景として記載する。",
      "同じ予審史料では、村野常右衛門ら3名について謀殺教唆の犯罪証憑が十分でないとして免訴とされている。",
      "第2回総選挙後も選挙干渉への責任追及は続き、『多摩市史』は1892年12月12日の神奈川県会で知事・警部長の罷免建議案が可決されたと記述する。"
    ],
    "coverage_limits": [
      "内海忠勝知事の1892年2月12日報告は『多摩市史』による原文引用まで確認したが、原史料画像は直接照合していない。",
      "神奈川県第3区全域の警察官配置、拘束・妨害行為、各町村・候補への影響を網羅的に復元していない。",
      "大須賀明殺害事件の裁判史料は町田市教育委員会による翻刻本文を確認したが、原本画像との文字単位の照合は行っていない。",
      "一般有権者・地域住民が選挙干渉や政治的暴力をどう認識したかを示す同時代新聞・日記・書簡等は限定的である。",
      "1892年の選挙干渉・県会での知事責任追及と1893年三多摩移管の因果関係は本Investigationでは確定していない。"
    ]
  },
  "working_answer": {
    "text": "現在の町田市域・南多摩の自由民権運動は、1880年代の地域民権運動から自由党への参加へ接続し、自由党解党後の再組織化と派閥分化を経て、1890年代初頭には国政選挙を主要な政治闘争の場とする段階へ移ったと整理できる。吉野泰三・石阪昌孝・瀬戸岡為一郎らの関係は固定的な二陣営ではなく、1890年第1回総選挙前には吉野が再興自由党に加盟して石阪との候補化を企図した一方、実際の自由党候補は石阪・瀬戸岡となり、1892年第2回総選挙では自由党の石阪・瀬戸岡に対して吉野・平林定兵衛が吏党側候補として競合した。第2回総選挙では、全国的な政府主導の選挙干渉に加えて、神奈川県第3区でも具体的な行政介入が確認できる。『多摩市史』が引用する1892年2月12日付の内海忠勝神奈川県知事から松方正義への報告では、八王子方面に巡査約100名を出し、石阪・瀬戸岡両名を落選させ『味方』の全勝を見込んでいたとされる。また村野常右衛門・森久保作蔵の拘束が記録され、『神奈川県史』も警察官の動員、民党壮士への拘束・圧迫、双方の衝突を叙述する。それでも神奈川県第3区では石阪890票、瀬戸岡720票が当選し、吉野663票が次点となったため、少なくとも内海知事が明示した石阪・瀬戸岡両名を落選させるという目的は実現しなかった。ただし、この結果だけから選挙干渉の得票効果がなかったと推定することはできない。さらに選挙対立は投票日に終わらず、町田市が公開する1892年の東京控訴院裁判言渡書翻刻は、大須賀明殺害事件について、被告らが石阪・瀬戸岡を当選させるため運動し、大須賀が当初の協力姿勢から吉野支持へ転じたことへの憤りを事件背景として記載している。一方、村野常右衛門らについては予審で謀殺教唆の証拠不十分として免訴とされており、地域指導者の教唆を断定することはできない。したがって1892年第2回総選挙がこの地域の政治状況に持った意味は、自由民権運動期に形成された組織・人的ネットワークが国政選挙の候補者・派閥競争へ再編され、そこへ県行政・警察による選挙干渉が加わり、対立が拘束・衝突・殺人事件、さらに県会での知事・警部長への責任追及にまで連続した政治局面として現れた点にある。なお、この一連の政治闘争が1893年の三多摩東京府移管をどの程度引き起こしたかは、RQ-0019では確定せず、別RQで独立に検証すべき論点である。",
    "knowledge_unit_refs": [
      "K0001",
      "K0002",
      "K0003",
      "K0004",
      "K0005",
      "K0006",
      "K0007",
      "K0008",
      "K0009",
      "K0010",
      "K0011",
      "K0012",
      "K0013",
      "K0014"
    ]
  },
  "judgments": [
    {
      "judgment_id": "J0001",
      "statement": "RQ-0019のEvidenceは、自由民権運動から政党政治・選挙政治への展開を、自由党参加、解党後の再編、候補者選定・派閥分化、国政選挙という連続した歴史過程として記述することを支持する。",
      "knowledge_unit_refs": [
        "K0001",
        "K0002",
        "K0003",
        "K0004"
      ]
    },
    {
      "judgment_id": "J0002",
      "statement": "吉野泰三の政治的位置づけは時期によって変化しており、1892年8月の国民協会加入を1890年や1892年2月へ遡及して固定的な『政府派』像を作るべきではない。",
      "knowledge_unit_refs": [
        "K0003",
        "K0004",
        "K0013"
      ]
    },
    {
      "judgment_id": "J0003",
      "statement": "1892年第2回総選挙の神奈川県第3区では、内海忠勝知事の報告、警察官投入、自由党系活動家の拘束等から、県行政が自由党候補の敗北を意図した具体的な選挙干渉が存在したと記述できる。",
      "knowledge_unit_refs": [
        "K0005",
        "K0006"
      ]
    },
    {
      "judgment_id": "J0004",
      "statement": "第3区では石阪昌孝・瀬戸岡為一郎が当選したため、内海知事が明示した両名落選という目的は達成されなかった。ただし、選挙結果のみから干渉の局地的得票効果がゼロだったとは判断できない。",
      "knowledge_unit_refs": [
        "K0006",
        "K0007",
        "K0008"
      ]
    },
    {
      "judgment_id": "J0005",
      "statement": "大須賀明殺害事件と地域の選挙対立との関係は、後世の解説だけでなく1892年東京控訴院裁判言渡書の翻刻から直接確認できる。",
      "knowledge_unit_refs": [
        "K0009",
        "K0011"
      ]
    },
    {
      "judgment_id": "J0006",
      "statement": "大須賀明殺害事件について、村野常右衛門ら地域指導者が謀殺を教唆したと断定することは、証拠不十分として免訴とした予審史料と整合しない。",
      "knowledge_unit_refs": [
        "K0010",
        "K0011"
      ]
    },
    {
      "judgment_id": "J0007",
      "statement": "第2回総選挙の地域政治上の意味は、地域民権運動の人的・組織的基盤が選挙政治へ再編され、既存の地域内対立と国家・県行政による介入が交差し、拘束・衝突・政治的暴力・県政上の責任追及まで生じた局面として把握するのがEvidenceに整合する。",
      "knowledge_unit_refs": [
        "K0004",
        "K0006",
        "K0009",
        "K0012"
      ]
    },
    {
      "judgment_id": "J0008",
      "statement": "1892年選挙干渉と県会での知事責任追及を1893年三多摩移管へ結びつける地域史的解釈は存在するが、RQ-0019のDescriptive analysisでは因果関係を確定せず、後続RQへ留保する。",
      "knowledge_unit_refs": [
        "K0012",
        "K0014"
      ]
    }
  ],
  "limitations": [
    {
      "text": "内海忠勝知事の1892年2月12日松方正義宛報告は『多摩市史』による原文引用まで確認したが、原史料画像は直接照合していない。",
      "knowledge_unit_refs": [
        "K0006",
        "K0007"
      ]
    },
    {
      "text": "神奈川県第3区全域の警察官配置、拘束・妨害行為、各町村・候補・運動員への影響を網羅的に復元していない。",
      "knowledge_unit_refs": [
        "K0006",
        "K0008"
      ]
    },
    {
      "text": "大須賀明殺害事件の裁判文書は町田市教育委員会による翻刻本文を確認したが、原本画像との文字単位の校訂は行っていない。",
      "knowledge_unit_refs": [
        "K0009",
        "K0010"
      ]
    },
    {
      "text": "一般有権者・地域住民が選挙干渉、壮士、拘束、政治的暴力をどのように認識したかを示す同時代の社会的受容資料は限定的である。",
      "knowledge_unit_refs": [
        "K0004",
        "K0006",
        "K0009"
      ]
    },
    {
      "text": "1890年から1892年にかけての各候補の町村別支持基盤や有権者ネットワークの量的変化は十分に復元していない。",
      "knowledge_unit_refs": [
        "K0003",
        "K0004"
      ]
    },
    {
      "text": "1892年の選挙干渉・県会での知事責任追及と1893年三多摩移管の因果関係は本Investigationでは判断していない。",
      "knowledge_unit_refs": [
        "K0012",
        "K0014"
      ]
    }
  ],
  "unresolved_questions": [
    "内海忠勝知事の1892年2月12日松方正義宛報告の原史料は、警察動員と候補者落選方針をどのような文脈・表現で記録しているのか。",
    "神奈川県第3区では、警察・地方官による選挙干渉が町村別・候補別にどの程度行われ、具体的にどの運動員・有権者が対象となったのか。",
    "1890年第1回総選挙から1892年第2回総選挙までに、石阪・瀬戸岡・吉野その他候補の支持基盤は町村別にどう変化したのか。",
    "大須賀明殺害事件の他の裁判記録・同時代新聞は、事件動機、共謀関係、凌霜館との関係をどのように記録しているのか。",
    "地域住民・一般有権者は選挙干渉、壮士、拘束、殺人事件をどのように認識・評価したのか。",
    "1892年12月の神奈川県会による知事・警部長罷免建議と、その後の三多摩東京府移管の意思決定はどのように接続していたのか。"
  ],
  "alternative_interpretations": [
    {
      "text": "1892年の三多摩の政治的緊張は、政府・県行政による選挙干渉だけで生じたのではなく、自由民権運動内部で以前から進んでいた壮士・穏健派、正義派、候補者選定をめぐる分化に外部介入が重なったと解釈できる。",
      "knowledge_unit_refs": [
        "K0002",
        "K0003",
        "K0004",
        "K0006"
      ]
    },
    {
      "text": "第3区で自由党2候補が当選したことは政府側の選挙目的が達成されなかったことを示すが、これは選挙干渉そのものが無効だったことの直接証明ではなく、局地的効果の評価には反実仮想を含む別の分析設計が必要である。",
      "knowledge_unit_refs": [
        "K0006",
        "K0007",
        "K0008"
      ]
    },
    {
      "text": "大須賀明殺害事件は地域の選挙対立との直接的関係が裁判史料から確認できる一方、全国的な選挙干渉を事件の直接原因とみなすには追加Evidenceが必要である。",
      "knowledge_unit_refs": [
        "K0005",
        "K0009",
        "K0010"
      ]
    },
    {
      "text": "1892年選挙闘争を1893年三多摩移管の直接原因として強く位置づける地域史的解釈がある一方、移管には水源・行政区域・東京府側の利害等も存在するため、RQ-0019のEvidenceだけで単因果化することはできない。",
      "knowledge_unit_refs": [
        "K0012",
        "K0014"
      ]
    }
  ]
}
