{
  "schema_version": "2.0.0",
  "artifact_type": "30_analysis",
  "investigation_id": "INV-000018",
  "rq_id": "RQ-0022",
  "analyzed_at": "2026-09-23T15:52:00.000Z",
  "question_type": "Descriptive",
  "profile": {
    "target": "1893年の三多摩東京府移管をめぐる現在の町田市域・南多摩の地域側主体の立場、行動形態、組織ネットワーク、および地域内部の差異。",
    "constructs": [
      "地域側の賛否の分化",
      "町村長層の反対陳情",
      "境域復旧請願",
      "公開演説",
      "町村長辞職・行政的抵抗",
      "現在の町田市域の具体的主体",
      "自由党・三郡交渉会の広域ネットワーク",
      "地域側と党中央の立場の不一致"
    ],
    "summary_statistics_or_patterns": [
      "三多摩地域側には賛成派・反対派が併存し、地域住民を単一意思として扱えない。",
      "南多摩では八王子を拠点とする三郡交渉会、反対演説会、町村長等の辞職・行政麻痺が確認できる。",
      "現在の町田市域では、鶴川村の井上吉之助が境域復旧交渉と演説を行った具体的主体として確認できる。",
      "野津田村出身の石阪昌孝は、法案成立後に境域復旧要求を自由党代議士総会へ持ち込み、神奈川県自由党大会でも復旧陳情を進める側にいた。",
      "反対・復旧運動は町村単位だけでなく、三郡交渉会と自由党武相支部という広域ネットワークを通じて展開された。",
      "法案成立後、要求は移管阻止から境域復旧・制度据置きへ形を変えた。",
      "地域側の復旧要求は自由党中央と必ずしも一致しなかった。",
      "南多摩・町田市域の賛成主体は今回のEvidenceでは反対主体と同程度には復元できていない。"
    ],
    "coverage_limits": [
      "三郡町村長の移管反対陳情書の署名者を全文確認していない。",
      "南多摩・現在の町田市域の移管賛成主体を人物・町村単位で十分に同定できていない。",
      "井上吉之助の演説は題目のみ確認しており、経済的主張の本文は未復元である。",
      "演説会・大会の参加者数は住民全体の賛否比率を示す統計ではない。",
      "一般住民、女性、非有権者、商工業者など地域エリート以外の立場は十分に復元できていない。",
      "本InvestigationはDescriptiveであり、自由民権運動・政党所属・経済利害が各主体の立場を因果的に決定したとは推定しない。"
    ]
  },
  "working_answer": {
    "text": "三多摩の東京府移管に対する現在の町田市域・南多摩の地域側の反応は、単一の「住民意思」ではなく、人物・町村・政治組織ごとに分かれていたと記述するのがEvidenceに最も整合する。東京都公文書館の史料解説は三多摩に賛成派と反対派が併存したことを示す一方、今回具体的に復元できた南多摩・町田市域の主体は反対・境域復旧側に偏っている。南多摩では、町村長層の反対陳情、八王子での三郡交渉会と反対演説会、町村長等の辞職による行政事務の麻痺が確認でき、行動は請願・演説・行政的抵抗に及んだ。現在の町田市域では、鶴川村の井上吉之助が三郡交渉会の代表委員として東京府知事へ境域復旧を前提とする制度据置きを申し入れ、別の演説会では「神奈川県と東京府との経済」を題目に演説した。また野津田村出身の石阪昌孝は、法案成立後に境域復旧要求を自由党代議士総会へ持ち込み、神奈川県自由党大会でも境域復旧陳情を進める側にいた。これらの運動は町村単位に閉じず、三郡交渉会や旧神奈川県域の自由党武相支部を介した広域ネットワークとして展開した。ただし、地域側の復旧要求は自由党中央には受け入れられず、政党内部でも立場は一様ではなかった。さらに、今回のEvidenceでは南多摩・町田市域の移管賛成主体を人物・町村単位で十分に復元できていないため、「南多摩全体が反対した」「町田住民が一体として反対した」と一般化することはできない。",
    "knowledge_unit_refs": ["K0001","K0002","K0003","K0004","K0005","K0006","K0007","K0008"]
  },
  "judgments": [
    {
      "judgment_id": "J0001",
      "statement": "三多摩地域側には賛成派と反対派が併存しており、「三多摩住民」または「町田住民」を単一意思主体として扱うべきではない。",
      "knowledge_unit_refs": ["K0001","K0008"]
    },
    {
      "judgment_id": "J0002",
      "statement": "南多摩で確認できる反対・復旧行動は、請願・陳情、公開演説、三郡交渉会による組織化、町村長等の辞職という複数のaction repertoireを含む。",
      "knowledge_unit_refs": ["K0002","K0007"]
    },
    {
      "judgment_id": "J0003",
      "statement": "現在の町田市域では、井上吉之助と石阪昌孝を、移管反対・境域復旧に関与した具体的地域主体として同定できる。",
      "knowledge_unit_refs": ["K0003","K0004"]
    },
    {
      "judgment_id": "J0004",
      "statement": "町田・南多摩の反対・復旧運動は、三郡交渉会と自由党武相支部を通じて広域的に組織され、現在の市域だけで完結していなかった。",
      "knowledge_unit_refs": ["K0003","K0004","K0005"]
    },
    {
      "judgment_id": "J0005",
      "statement": "地域側の境域復旧要求と自由党中央の判断は一致しておらず、自由党を一枚岩の反対主体として扱うこともできない。",
      "knowledge_unit_refs": ["K0004","K0006"]
    },
    {
      "judgment_id": "J0006",
      "statement": "法案成立・移管施行後も運動は終わらず、要求の形を境域復旧・制度据置きへ変えて継続した。",
      "knowledge_unit_refs": ["K0007"]
    },
    {
      "judgment_id": "J0007",
      "statement": "今回のEvidence coverageは反対・復旧主体に偏っているため、南多摩・町田市域の多数派意思や賛否比率を推定しない。",
      "knowledge_unit_refs": ["K0001","K0008"]
    }
  ],
  "limitations": [
    {
      "text": "三郡町村長の移管反対陳情書について、個々の署名者を全文確認しておらず、現在の町田市域各町村長の参加状況は確定していない。",
      "knowledge_unit_refs": ["K0002"]
    },
    {
      "text": "南多摩・現在の町田市域の移管賛成主体を人物・町村・組織単位で十分に同定できていない。これは賛成主体が存在しなかったことを意味しない。",
      "knowledge_unit_refs": ["K0001","K0008"]
    },
    {
      "text": "井上吉之助の演説は題目のみ確認しており、「神奈川県と東京府との経済」に関する具体的主張は復元できていない。",
      "knowledge_unit_refs": ["K0003"]
    },
    {
      "text": "演説会・大会の参加人数は同時代新聞等を介した自治体史の整理を含み、住民全体の賛否比率へ一般化できない。",
      "knowledge_unit_refs": ["K0002","K0005"]
    },
    {
      "text": "一般住民、女性、非有権者、商工業者など地域エリート以外の立場は今回のselected Evidenceでは十分に復元できていない。",
      "knowledge_unit_refs": ["K0001","K0008"]
    },
    {
      "text": "本InvestigationはDescriptiveであり、自由民権運動、政党所属、経済利害と移管への賛否との因果効果は同定していない。",
      "knowledge_unit_refs": ["K0003","K0004","K0005"]
    }
  ],
  "unresolved_questions": [
    "三郡町村長の移管反対陳情書には、現在の町田市域のどの町村長が署名していたのか。",
    "南多摩・現在の町田市域で移管賛成または容認を明示した人物・町村・団体は誰だったのか。",
    "井上吉之助の「神奈川県と東京府との経済」演説本文または同時代新聞報道から、具体的な経済的反対理由を復元できるか。",
    "一般住民・商工業者・非有権者・女性は移管と反対運動をどのように認識していたのか。",
    "町村長辞職・役場機能停止は南多摩のどの町村で、どの期間、どの程度発生したのか。"
  ],
  "alternative_interpretations": [
    {
      "text": "南多摩で反対運動の記録が多いことは、反対が地域多数派だったことを示す可能性はあるが、賛成側史料の保存・収集の非対称性でも説明できるため、本Investigationでは多数派判定を行わない。",
      "knowledge_unit_refs": ["K0001","K0008"]
    },
    {
      "text": "境域復旧運動は旧神奈川県への地域的帰属意識だけでなく、行政制度、経済利害、既存の自由党人的ネットワークの維持という複数の関心が重なった行動として理解する余地がある。",
      "knowledge_unit_refs": ["K0003","K0004","K0005"]
    },
    {
      "text": "自由党中央が復旧要求を受け入れなかったことから、地域の反対運動を自由党の中央方針の単純な延長として理解するのは適切でない。",
      "knowledge_unit_refs": ["K0006"]
    }
  ]
}
