{
  "schema_version": "2.0.0",
  "artifact_type": "30_analysis",
  "investigation_id": "INV-000033",
  "rq_id": "RQ-000033",
  "analyzed_at": "2026-09-29T06:42:00.000Z",
  "question_type": "Comparative",
  "profile": {
    "comparison_units": [
      "RQ-000031候補A『名前が旧橋へ戻る』",
      "RQ-000031候補B『物流だけが橋を移る』",
      "RQ-000031候補C『三つの二川』",
      "RQ-000031候補D『二つの村が一つの宿になる』",
      "RQ-000031候補E『二十三キロの近道』",
      "RQ-000031候補F『土地ではなく水路が住所を決める』"
    ],
    "comparison_dimensions": [
      "現実アンカーの統合方法：名称・位置履歴、物流履歴、集落移転層、集落統合、長距離水利接続、造成地identityとインフラ接続",
      "D21 A0–A4：canonical definitionは比較基準として用いるが、candidate-side assignmentはcurrent upstreamで未割当",
      "Candidate-side provisional specified: D07,D09,D10,D11,D13,D15,D16,D17,D18",
      "Candidate-side explicitly unresolved: D01–D06,D19–D20",
      "Candidate-side not explicitly assigned: D08,D12,D14,D21"
    ],
    "contrasts": [
      "AとBは同じ吉田大橋／とよばし系アンカーを使うが、Aは名称・位置履歴を経路認識へ、Bは物流中心移動を持ち物・経路情報の再対応へ因果化する。",
      "CとDは同じ二川村・大岩村の移転・宿場形成史を使うが、Cは歴史的空間層の切替、Dは集落境界・目的地の統合を因果規則にする。",
      "EとFは同じ神野新田＋牟呂用水系アンカーを使うが、Eは水路接続順による位置・距離再解釈、Fはインフラ接続による土地identity規定を中心規則にする。",
      "Fixed INV-000032との整合上、A/C/Dの主要差はD07の名称・場所・集落identity再配置、E/Fの主要差はD10のインフラ／ネットワーク因果源、Bは史実統合を位置・所有情報再対応へ変換する点に現れる。",
      "D16とD18=L1は候補群の強い識別子ではなく、D17はcorpus側でもheterogeneousかつUnknownが多いため、現実アンカー統合方法との単純対応を置けない。",
      "D21は6候補すべてcurrent upstreamで未割当であり、A0–A4の候補間差をcanonical resultとして記述できない。"
    ],
    "comparability_limits": [
      "RQ-000031候補A–Fは流通した実在伝承ではなく、candidate_hypothesesとして設計されたprovisional creative modelsである。",
      "D07,D09,D10,D11,D13,D15,D16,D17,D18の記述もformal Entry codingではなくprovisional specifiedである。",
      "D01–D06,D19–D20はexplicitly unresolved、D08,D12,D14,D21はnot explicitly assignedであり、U/NA/Cや任意codeとして補完しない。",
      "frozen 00_contextは『RQ-000032で確定したD01–D21 coding』をincludeするが、fix済みcurrent INV-000032はfull D01–D21 candidate codingを確定していない。この差をdownstream推測で埋めない。",
      "本比較は意図的に生成された6候補のdesign set内のassociationであり、D21または現実アンカー統合方法が他Dimensionを因果的に変えるという一般効果を推定しない。"
    ]
  },
  "working_answer": {
    "text": "Fix済みupstreamに基づくと、現実アンカーの統合方法の違いは、候補A–Fのうち現在比較可能な範囲では主としてD07–D10を中心とする構造差として現れる。A/Bでは同じ橋アンカーから名称・位置履歴と物流履歴を別々に因果化し、C/Dでは同じ集落移転史から歴史的空間層の切替と集落境界の統合を分離し、E/Fでは同じ水利・造成アンカーから接続順による位置再解釈とインフラによる土地identity規定を分離している。一方、candidate-sideのD21はfixed INV-000032で明示的に未割当であり、canonical coding ruleも未割当値の推測を禁じるため、A0–A4の候補間差は現Evidenceでは確定できない。D16とD18=L1は識別性が弱く、D17はheterogeneousで、D01–D06,D19–D20はunresolved、D08,D12,D14もunassignedである。したがって支持できる結論は、現実アンカーの『どの現実構造を伝承内規則へ変換するか』とD07–D10構造とのdesign内対応であり、D21差やD01–D21全体への因果効果ではない。",
    "knowledge_unit_refs": [
      "K0001",
      "K0002",
      "K0003",
      "K0004",
      "K0005",
      "K0006",
      "K0007",
      "K0008"
    ]
  },
  "judgments": [
    {
      "judgment_id": "J0001",
      "statement": "同一または近接した現実アンカーからでも、因果化する現実構造を変えると別の伝承モデルが成立する。A/B、C/D、E/Fの各pairがこれを示す。",
      "knowledge_unit_refs": [
        "K0001",
        "K0002",
        "K0003"
      ]
    },
    {
      "judgment_id": "J0002",
      "statement": "現実アンカー統合方法との対応がcurrent evidenceで最も明瞭なのはD07–D10であり、特に意味形成対象と因果源の選択に差が集中する。",
      "knowledge_unit_refs": [
        "K0006"
      ]
    },
    {
      "judgment_id": "J0003",
      "statement": "候補A–FのD21はcurrent upstreamで未割当であるため、A0–A4を候補別に確定することはできず、旧INV-000033で行われていたA2/A3/A4推測割当はcurrent resultとして維持しない。",
      "knowledge_unit_refs": [
        "K0004",
        "K0005",
        "K0007"
      ]
    },
    {
      "judgment_id": "J0004",
      "statement": "D16およびD18=L1は候補群の主要な識別差ではなく、D17もheterogeneousであるため、現実アンカー統合方法からこれらのDimension差を自動的に説明しない。",
      "knowledge_unit_refs": [
        "K0008"
      ]
    },
    {
      "judgment_id": "J0005",
      "statement": "D01–D06,D19–D20はunresolved、D08,D12,D14はunassignedであり、現実アンカー統合方法との対応を評価する対象から外す必要がある。",
      "knowledge_unit_refs": [
        "K0004"
      ]
    },
    {
      "judgment_id": "J0006",
      "statement": "観察された対応は意図的design set内のassociationであり、D21や現実アンカー統合方法が他Dimensionへ一般的な因果効果を持つとは結論しない。",
      "knowledge_unit_refs": [
        "K0006",
        "K0007"
      ]
    }
  ],
  "limitations": [
    {
      "text": "frozen 00_contextのincludeには『RQ-000032で確定したD01–D21 coding』があるが、fix済みINV-000032ではcandidate-side full D01–D21 codingは成立していない。本Investigationではfrozen contextを書き換えず、その不足をlimitationとして保持した。",
      "knowledge_unit_refs": [
        "K0004",
        "K0007"
      ]
    },
    {
      "text": "候補A–Fは正式Entry codingではなくprovisional creative designであるため、formal D21 assignmentには各候補のVersion Scopeを固定した追加codingが必要である。",
      "knowledge_unit_refs": [
        "K0004",
        "K0005",
        "K0007"
      ]
    },
    {
      "text": "A/C/DのD07 identity再配置やE/FのD10 infrastructure/network因果源はstructural contrastとして観察できるが、taxonomy gapの最終確定は別途codebook照合・formal codingが必要である。",
      "knowledge_unit_refs": [
        "K0006"
      ]
    },
    {
      "text": "牟呂用水の完成年はSRC-000146内で1888年／1899年が競合している。E/Fの比較は約23kmの接続構造に依存し、単一完成年には依存しない。",
      "knowledge_unit_refs": [
        "K0003"
      ]
    },
    {
      "text": "6候補は小規模な意図的design setであり、都市伝説一般の代表標本ではない。",
      "knowledge_unit_refs": [
        "K0006"
      ]
    }
  ],
  "unresolved_questions": [
    "候補A–Fをformal EntryとしてVersion Scope固定した場合、D21 A0–A4はそれぞれどの値になるか？",
    "候補E/FのD10 infrastructure/network causal sourceは既存codebookのChildで表現可能か、それともtaxonomy gapか？",
    "候補A/C/DのD07 identity再配置を既存SPATIAL_ROUTE_ANOMALY等へ近似すべきか、独立した上位概念を設けるべきか？",
    "formal coding時にD08,D12,D14をどのEvidenceで確定するか？",
    "D01–D06,D19–D20を実証codingできるだけの流通・生成Evidenceを、創作候補に対してどの時点で成立させるか？"
  ],
  "alternative_interpretations": [
    {
      "text": "現実アンカー統合方法をD21の序数差そのものとして読むのではなく、D07–D10に現れる設計選択として扱い、D21はformal codingが成立するまで独立して未割当のまま保持する解釈がcurrent evidenceに最も保守的である。",
      "knowledge_unit_refs": [
        "K0004",
        "K0005",
        "K0006",
        "K0007"
      ]
    },
    {
      "text": "A/B、C/D、E/Fのpair差は現実アンカー自体の違いではなく、同じ史実・地域構造からどの関係を因果化するかというdesigner choiceによって生じていると解釈できる。",
      "knowledge_unit_refs": [
        "K0001",
        "K0002",
        "K0003",
        "K0006"
      ]
    }
  ]
}
